{
  "schema_version": "2.0",
  "artifact_id": "art_fixture_review",
  "type": "review",
  "title": "review: duplicate check removed from OrderService.create",
  "repository": {
    "id": "repo",
    "head_commit": "worktree:469cf2cfa1507a911c486baf48c9a83838915dad:8227662588919db6",
    "base_commit": "469cf2cfa1507a911c486baf48c9a83838915dad"
  },
  "slice": {
    "entry_points": [
      "orders/service.py"
    ],
    "hop_limit": 2,
    "file_count": 5,
    "excludes": [],
    "truncations": []
  },
  "inputs": {
    "skill_version": "0.1.0",
    "schema_version": "2.0"
  },
  "index": {
    "files": [
      {
        "path": "notifications/email.py",
        "language": "python",
        "sha256": "sha256:7b5070fc800fd05b1fefa00489935b8fc81e4a407b62de842746efc3c0ec83b0",
        "source": "def send_receipt(customer_id: str, receipt_id: str) -> None:\n    format_receipt(customer_id, receipt_id)\n\n\ndef format_receipt(customer_id: str, receipt_id: str) -> str:\n    return f\"receipt {receipt_id} for {customer_id}\"\n"
      },
      {
        "path": "orders/models.py",
        "language": "python",
        "sha256": "sha256:387747ffe8bddf097eca45d235eed0c562a83e78b93f41c22eb2bff7c559b71b",
        "source": "from dataclasses import dataclass, field\nfrom enum import Enum\nfrom uuid import uuid4\n\n\nclass OrderStatus(Enum):\n    PENDING = \"pending\"\n    PAID = \"paid\"\n    FAILED = \"failed\"\n\n\n@dataclass\nclass Order:\n    customer_id: str\n    amount_cents: int\n    status: OrderStatus = OrderStatus.PENDING\n    idempotency_key: str = field(default_factory=lambda: str(uuid4()))\n\n    def mark_paid(self) -> None:\n        self.status = OrderStatus.PAID\n\n    def mark_failed(self) -> None:\n        self.status = OrderStatus.FAILED\n"
      },
      {
        "path": "orders/repository.py",
        "language": "python",
        "sha256": "sha256:fdeccb78dcedb0d418066642785096b686651e83c5c7ffaa0d9a8d7c9e16ca6d",
        "source": "import sqlite3\n\nfrom orders.models import Order, OrderStatus\n\nDB_PASSWORD = \"super-secret-db-password-123\"\n\n\nclass OrderRepository:\n    def __init__(self, path: str = \":memory:\"):\n        self.conn = sqlite3.connect(path)\n        self.conn.execute(\n            \"CREATE TABLE IF NOT EXISTS orders \"\n            \"(key TEXT PRIMARY KEY, customer TEXT, amount INTEGER, status TEXT)\"\n        )\n\n    def save(self, order: Order) -> None:\n        self.conn.execute(\n            \"INSERT OR REPLACE INTO orders VALUES (?, ?, ?, ?)\",\n            (order.idempotency_key, order.customer_id, order.amount_cents, order.status.value),\n        )\n        self.conn.commit()\n\n    def get(self, idempotency_key: str) -> Order | None:\n        row = self.conn.execute(\n            \"SELECT customer, amount, status FROM orders WHERE key = ?\",\n            (idempotency_key,),\n        ).fetchone()\n        if row is None:\n            return None\n        order = Order(customer_id=row[0], amount_cents=row[1], status=OrderStatus(row[2]))\n        order.idempotency_key = idempotency_key\n        return order\n"
      },
      {
        "path": "orders/service.py",
        "language": "python",
        "sha256": "sha256:edb8464676a307283bdc5467bbd05a51de0523c1e4005d36a40051ea1b6a641d",
        "source": "from orders.models import Order\nfrom orders.repository import OrderRepository\nfrom payments.gateway import PaymentGateway\n\n\nclass DuplicateOrderError(Exception):\n    pass\n\n\nclass OrderService:\n    \"\"\"Entry point for order creation. Prevents duplicates via idempotency_key.\"\"\"\n\n    def __init__(self, repo: OrderRepository, gateway: PaymentGateway):\n        self.repo = repo\n        self.gateway = gateway\n\n    def create(self, customer_id: str, amount_cents: int, idempotency_key: str) -> Order:\n\n        order = Order(customer_id=customer_id, amount_cents=amount_cents)\n        order.idempotency_key = idempotency_key\n        self.repo.save(order)\n\n        try:\n            self.gateway.charge(customer_id, amount_cents, idempotency_key)\n        except Exception:\n            order.mark_failed()\n            self.repo.save(order)\n            raise\n\n        order.mark_paid()\n        self.repo.save(order)\n        return order\n\n\ndef audit_order(order):\n    return order.idempotency_key\n"
      },
      {
        "path": "payments/gateway.py",
        "language": "python",
        "sha256": "sha256:98da4a8b884b3c1e0a16004be45b041b5cbed8a31684ece453847dafb276edab",
        "source": "from notifications.email import send_receipt\n\nAPI_KEY = \"pk_live_abcdef0123456789abcdef\"\n\n\nclass ChargeFailedError(Exception):\n    pass\n\n\nclass PaymentGateway:\n    def __init__(self, endpoint: str = \"https://pay.example.com\"):\n        self.endpoint = endpoint\n\n    def charge(self, customer_id: str, amount_cents: int, idempotency_key: str) -> str:\n        receipt_id = self._post(\n            \"/charges\",\n            {\n                \"customer\": customer_id,\n                \"amount\": amount_cents,\n                \"idempotency_key\": idempotency_key,\n            },\n        )\n        send_receipt(customer_id, receipt_id)\n        return receipt_id\n\n    def _post(self, path: str, payload: dict) -> str:\n        if payload.get(\"amount\", 0) <= 0:\n            raise ChargeFailedError(\"amount must be positive\")\n        return f\"rcpt_{payload['idempotency_key'][:8]}\"\n"
      }
    ],
    "symbols": [
      {
        "symbol_id": "python:notifications.email",
        "kind": "module",
        "name": "email",
        "qualname": "",
        "path": "notifications/email.py",
        "range": {
          "start_line": 1,
          "start_character": 0,
          "end_line": 7,
          "end_character": 0
        },
        "content_hash": "sha256:7b5070fc800fd05b1fefa00489935b8fc81e4a407b62de842746efc3c0ec83b0",
        "signature": "module notifications.email",
        "in_slice": true
      },
      {
        "symbol_id": "python:notifications.email:send_receipt",
        "kind": "function",
        "name": "send_receipt",
        "qualname": "send_receipt",
        "path": "notifications/email.py",
        "range": {
          "start_line": 1,
          "start_character": 0,
          "end_line": 2,
          "end_character": 43
        },
        "content_hash": "sha256:539a9bfe6c7f2b2bd46489056ae0e42b6ecdf813284bba487971f73b7d5cb405",
        "signature": "def send_receipt(customer_id: str, receipt_id: str) -> None",
        "parent": "python:notifications.email",
        "in_slice": true
      },
      {
        "symbol_id": "python:notifications.email:format_receipt",
        "kind": "function",
        "name": "format_receipt",
        "qualname": "format_receipt",
        "path": "notifications/email.py",
        "range": {
          "start_line": 5,
          "start_character": 0,
          "end_line": 6,
          "end_character": 52
        },
        "content_hash": "sha256:effe49da955ecf67a7d1cf63d5c26bef26b35e398fcd471e6ecc95f2c3be5d3b",
        "signature": "def format_receipt(customer_id: str, receipt_id: str) -> str",
        "parent": "python:notifications.email",
        "in_slice": true
      },
      {
        "symbol_id": "python:orders.models",
        "kind": "module",
        "name": "models",
        "qualname": "",
        "path": "orders/models.py",
        "range": {
          "start_line": 1,
          "start_character": 0,
          "end_line": 24,
          "end_character": 0
        },
        "content_hash": "sha256:387747ffe8bddf097eca45d235eed0c562a83e78b93f41c22eb2bff7c559b71b",
        "signature": "module orders.models",
        "in_slice": true
      },
      {
        "symbol_id": "python:orders.models:OrderStatus",
        "kind": "class",
        "name": "OrderStatus",
        "qualname": "OrderStatus",
        "path": "orders/models.py",
        "range": {
          "start_line": 6,
          "start_character": 0,
          "end_line": 9,
          "end_character": 21
        },
        "content_hash": "sha256:ae48be6c3d92a1cc68d6df572664eb52c97541de0a73b311bc8cb27c2f26740b",
        "signature": "class OrderStatus(Enum)",
        "parent": "python:orders.models",
        "in_slice": true
      },
      {
        "symbol_id": "python:orders.models:Order",
        "kind": "class",
        "name": "Order",
        "qualname": "Order",
        "path": "orders/models.py",
        "range": {
          "start_line": 12,
          "start_character": 0,
          "end_line": 23,
          "end_character": 40
        },
        "content_hash": "sha256:5d6ed2020624a3133c7e9653ad3a0b7bbde638d11a6389aa1141f8794f44a70c",
        "signature": "@dataclass",
        "parent": "python:orders.models",
        "in_slice": true
      },
      {
        "symbol_id": "python:orders.models:Order.mark_paid",
        "kind": "method",
        "name": "mark_paid",
        "qualname": "Order.mark_paid",
        "path": "orders/models.py",
        "range": {
          "start_line": 19,
          "start_character": 4,
          "end_line": 20,
          "end_character": 38
        },
        "content_hash": "sha256:062f0122e5815035c518e06348da10f09194b5ef8e370e3b02859fed3c306846",
        "signature": "def mark_paid(self) -> None",
        "parent": "python:orders.models:Order",
        "in_slice": true
      },
      {
        "symbol_id": "python:orders.models:Order.mark_failed",
        "kind": "method",
        "name": "mark_failed",
        "qualname": "Order.mark_failed",
        "path": "orders/models.py",
        "range": {
          "start_line": 22,
          "start_character": 4,
          "end_line": 23,
          "end_character": 40
        },
        "content_hash": "sha256:6482673395a1f75cb3b2172caf44f29d9601adf065f61849f13db90684009442",
        "signature": "def mark_failed(self) -> None",
        "parent": "python:orders.models:Order",
        "in_slice": true
      },
      {